,asin,reviewerName,reviewText,overall,summary,post_neg,original_title,overview
0,B000GFDAUG,"Aaron L. Allen ""Orgazmo1009""",CA Lewsi' review should be removed. he's reviewing a episode from season 10. If your gonna write a review do it for the whole season not 1 episode thats not even on the season your reviewing it for.,5,Stupid,1,Avatar,In the 22nd century a paraplegic Marine is dispatched to the moon Pandora on a unique mission but becomes torn between following orders and protecting an alien civilization.
1,B000GFDAUG,Mind's Clay,"I truly love the humor of South Park. It's social/political commentary and satirical wit and bathroom absurdity rules. No holds barred! I live to breathe another day in anticipation of Trey Parker's next installment whether it be South Park or some other venture. South Park is truly the work of a genius. Thank you Sir Parker. (In Britian they often ""knight"" certian individuals (usually after they are ""old"" or ""dead"") for their contributions to their society) :)Sometimes it is dry. Sometimes it is wet. And sometimes it is too moist for humor. But somebody has to do it!I would like to see new South Park episodes until the day I leave this mortal existence. However I know that Sir Parker would want to ""move on"". However I would much like to see South Park from the eyes of a 90 year old Trey Parker. What wisdom would we see then?....",5,"""More Moist Than Should Be"" Humor",1,Pirates of the Caribbean: At World's End,Captain Barbossa long believed to be dead has come back to life and is headed to the edge of the Earth with Will Turner and Elizabeth Swann. But nothing is quite as it seems.
2,B000GIOPK2,"202_d ""202_d""",This is a cartoon series pitting eight cartoon stereotypes in a pseudo reality TV environment.I have watched all three seasons (only three are on DVD) and this one is the funniest overall. All three are worth a watch this one is best. The average price of this box set here on Amazon  makes it an affordable laugh.While it is possible to start watching with any season of this show I almost always recommend starting with season one; not too much sequential  story line.This is parody/satirical humor. This type of humor is not for everyone. The smarter you are the more jokes you will understand; some jokes are subtle.,4,"Overall, really like the series.",1,Spectre,A cryptic message from Bond’s past sends him on a trail to uncover a sinister organization. While M battles political forces to keep the secret service alive Bond peels back the layers of deceit to reveal the terrible truth behind SPECTRE.
3,B000GIOPK2,"Alexandra Stephens ""dreamgirl0922""",Yeah drawn together is great when it comes to the crude humor. The first season was hilarious but sometimes i found the second season lacking. But it still was a great season. A definite buy is you're a fan of crude humor and hilarious cartoons.,4,Crude cartoon humor...Check,1,The Dark Knight Rises,Following the death of District Attorney Harvey Dent Batman assumes responsibility for Dent's crimes to protect the late attorney's reputation and is subsequently hunted by the Gotham City Police Department. Eight years later Batman encounters the mysterious Selina Kyle and the villainous Bane a new terrorist leader who overwhelms Gotham's finest. The Dark Knight resurfaces to protect a city that has branded him an enemy.
4,B000GIOPK2,Andre Villemaire,So this show is absurd and completely sucks. I hated way director changed the entire storyline.,2,not bad...,0,John Carter,John Carter is a war-weary former military captain who's inexplicably transported to the mysterious and exotic planet of Barsoom (Mars) and reluctantly becomes embroiled in an epic conflict. It's a world on the brink of collapse and Carter rediscovers his humanity when he realizes the survival of Barsoom and its people rests in his hands.
5,B000GIOPK2,A. Pierre,I dont agree with the reviewer who says the show wears thin after awhile. Ive watched each show about 3-5 times a piece and I cant get enough of the show its a very funny and probably one of the best cartoons on tv today. I dont know how ratings are doing for the show but if they release them via dvd i'll keep on buying them. Xandir and Tim Sitting in a Tree is my favorite of the season but all the shows are funny. The more you watch the more you pick up the little stuff you might have missed. Highly recommend this show to anyone who enjoys adult cartoons its much better then South Park.,5,Excellent,1,Spider-Man 3,The seemingly invincible Spider-Man goes up against an all-new crop of villain – including the shape-shifting Sandman. While Spider-Man’s superpowers are altered by an alien organism his alter ego Peter Parker deals with nemesis Eddie Brock and also gets caught up in a love triangle.
6,B000GIOPK2,B. E Jackson,Apparently I'm one of the few who really thinks Drawn Together is a fantastic animated show.  The animation is really good overall second only to the Simpsons.  Very bright colorful animation that makes everything look very nice.  A wide variety of creative characters each with their own special personality and goofy problems.  Solid storytelling that makes the characters more interesting and a very wild adult sense of humor that has *so* much creativity you can barely keep up with the constant jumping around.  Imagine a more violent Simpsons or Futurama with the pacing in hyper mode.  That's basically what Drawn Together is all about.,5,drawn together nicely,1,Tangled,When the kingdom's most wanted-and most charming-bandit Flynn Rider hides out in a mysterious tower he's taken hostage by Rapunzel a beautiful and feisty tower-bound teen with 70 feet of magical golden hair. Flynn's curious captor who's looking for her ticket out of the tower where she's been locked away for years strikes a deal with the handsome thief and the unlikely duo sets off on an action-packed escapade complete with a super-cop horse an over-protective chameleon and a gruff gang of pub thugs.
7,B000GIOPK2,"Ben Lawrence ""Ben Lawrence""",I liked this product. I am a big fan of Drawn together and this is the best season so far. The extra features are cool and I can't wait until the next season comes out.,4,Drawn Together,1,Avengers: Age of Ultron,When Tony Stark tries to jumpstart a dormant peacekeeping program things go awry and Earth’s Mightiest Heroes are put to the ultimate test as the fate of the planet hangs in the balance. As the villainous Ultron emerges it is up to The Avengers to stop him from enacting his terrible plans and soon uneasy alliances and unexpected action pave the way for an epic and unique global adventure.
8,B000GIOPK2,Big Dog,the show. it is really funny. it is a good show to get on Dvd. I like the show a lot.,5,it was cool,1,Harry Potter and the Half-Blood Prince,As Harry begins his sixth year at Hogwarts he discovers an old book marked as 'Property of the Half-Blood Prince' and begins to learn more about Lord Voldemort's dark past.
9,B000GIOPK2,Brandon Nolta,People who like cartoons must be thankful for DVDs because that technology opened up the floodgates for fans for every kind of animation. Whether you like classic Looney Tunes hippy-dippy sci-fi parables or Asian tentacle porn it's all there for you to find and enjoy. It's only been in the last 20 years or so however that American TV networks have clued into the idea that many adults like cartoons that have content specifically aimed at adults even though some cartoons did well in prime-time even fifty years ago or so. Now with DVD you can not only watch entire seasons at a shot you can also see the shows in their unadulterated glory.Which brings us to the Comedy Central series Drawn Together. I've been a fan of this show for a while partly because of the writing and partly because of the cheerful way in which it steamrolls political correctness and good taste. If South Park is the Mount Everest of crude crass animation then Drawn Together is K2; it doesn't stand as tall but it's a tougher climb. The truth of this was brought home upon watching the second season of the show on DVD. Much to my surprise watching the DVD turned out to be a different experience than watching it in first run.Part of this is due to one of the DVD set's selling points: it's unexpurgated. I didn't think this would make much of a difference as it's generally pretty clear what's been cut. As it turns out there was a lot cut out of the show and not just language: genitalia violence enough racist abuse to make the KKK turn red under their sheets sex in a vast array of configurations and a whole lot of other content that probably produces instant pucker in the unfortunate souls who work in Comedy Central's Standards and Practices department. Now I'm not one for censorship but the additional material works against the show to a certain degree. What's there is still funny in multiple senses from satire to slapstick but actually being able to hit the money words (and shots) dilutes the humor a bit.As far as taste goes DT is not a show to start novices on. If adult animation is still a new concept for you and you think The Simpsons is bleeding-edge in the sometimes fluid space between being socially acceptable and being a pariah then DT may cause seizures. For people who like edgy animation this will be just the ticket. The voiceover artists and writers take their material seriously and they're willing to go wherever the jokes take them (the season finale has a running gag with historical dates and the episodes connected to them that manages to be both subtle and sick).In terms of presentation the DT set is relatively bare-bones. The whole season of 15 episodes is crammed onto two discs leaving just enough room for a handful of interviews with the voiceover artists (minus Adam Carolla who has plenty to do outside the show) and a karaoke singalong. The visual quality is pretty sharp and the sound quality is good but this isn't the kind of material you use to do any THX certifications with so it's not like you'd expect much. Still it's the episodes that matter and for you sick little monkeys out there who like this kind of thing Drawn Together season 2 is a worthwhile expenditure. Just don't leave it out where Grandma or the kids might get a hold of it. Either you'll scar them for life (maybe shuffling Granny into an early grave) or you'll never get it back.,5,"Funny, vulgar and sick: three of my favorite things...",1,Batman v Superman: Dawn of Justice,Fearing the actions of a god-like Super Hero left unchecked Gotham City’s own formidable forceful vigilante takes on Metropolis’s most revered modern-day savior while the world wrestles with what sort of hero it really needs. And with Batman and Superman at war with one another a new threat quickly arises putting mankind in greater danger than it’s ever known before.
10,B000GIOPK2,Brett Rumpelstiltskin,Very adult humor cutting in sarcasm and dry take on reality shows in the least.,5,A great adult series,1,Superman Returns,Superman returns to discover his 5-year absence has allowed Lex Luthor to walk free and that those he was closest too felt abandoned and have moved on. Luthor plots his ultimate revenge that could see millions killed and change the face of the planet forever as well as ridding himself of the Man of Steel.
11,B000GIOPK2,Candi,I already had seasons 1 and 3 so I'm pretty happy that I finally got season 2. If you haven't seen the show before it's insanely offensive and hilarious. So you have been warned. Enjoy!,5,Finally completed my collection!,1,Quantum of Solace,Quantum of Solace continues the adventures of James Bond after Casino Royale. Betrayed by Vesper the woman he loved 007 fights the urge to make his latest mission personal. Pursuing his determination to uncover the truth Bond and M interrogate Mr. White who reveals that the organization that blackmailed Vesper is far more complex and dangerous than anyone had imagined.
12,B000GIOPK2,"ChibiNeko ""Sooo many books, so little time!""",Fans of the previous season of Drawn Together will both be overjoyed to see this DVD set & a little disappointed. Those who aren't into extremely crude humor won't be as entertained though.This season picks up with the previous's cliffhanger of the plane crash then quickly tries to top the previous season. It pokes fun at the shows & characters that it's based on as well as making jabs at it's critics. The DVD set is uncensored which is nice but some of the jokes lose a bit of their punch. Half of the fun of watching it on TV is that things are blurred & curse words are bleeped. Even so fans of this series will be glad to own this set. Anyone else? Better off renting it.,5,"Always funny, but not for everyone.",1,Pirates of the Caribbean: Dead Man's Chest,Captain Jack Sparrow works his way out of a blood debt with the ghostly Davey Jones he also attempts to avoid eternal damnation.
13,B000GIOPK2,Christopher Ward,Ok! This show is is absurd and is bad ,2,Thin comedy disguised with predictable shock value,0,The Lone Ranger,The Texas Rangers chase down a gang of outlaws led by Butch Cavendish but the gang ambushes the Rangers seemingly killing them all. One survivor is found however by an American Indian named Tonto who nurses him back to health. The Ranger donning a mask and riding a white stallion named Silver teams up with Tonto to bring the unscrupulous gang and others of that ilk to justice.
14,B000GIOPK2,Coral Twining,I gave it one star because of the quality of these videos. This is what I hate the most .I would not recommend this to anyone even if they enjoy watching this show.,1,Completely dissatisfied with video quality and censorship.,0,Man of Steel,A young boy learns that he has extraordinary powers and is not of this earth. As a young man he journeys to discover where he came from and what he was sent here to do. But the hero in him must emerge if he is to save the world from annihilation and become the symbol of hope for all mankind.
15,B000GIOPK2,David Meldrum,This short lived show has it's moments and some episodes are pretty decent. I would recommend this show for any adult cartoon aficionado a parody-spoof on stupid reality shows. For that reason and good voice work and interesting characters I would recommend this DVD for any adult cartoon fan.,4,"Another vulgar adult cartoon, but pretty good overall",1,The Chronicles of Narnia: Prince Caspian,One year after their incredible adventures in the Lion the Witch and the Wardrobe Peter Edmund Lucy and Susan Pevensie return to Narnia to aid a young prince whose life has been threatened by the evil King Miraz. Now with the help of a colorful cast of new characters including Trufflehunter the badger and Nikabrik the dwarf the Pevensie clan embarks on an incredible quest to ensure that Narnia is returned to its rightful heir.
16,B000GIOPK2,Elliot Reed,"Finally this is out! The first season came out a few years ago and the long awaited season 2 finally gets a dvd release. Well this is a great show (although not for youngsters) and the laughs just keep on coming. The special features are kind of lacking only given some commentaries and of course a karaoke sing along. There are 15 uncensored episodes including the episode ""Terms of Endearment"" which was not included in the first season dvd due to legal problems. Anyways a funny show filled with potty humor not nessesarily smart or witty but fun nonetheless. Get it before they take it off the shelfs!",5,Animation Domination!!,1,The Avengers,When an unexpected enemy emerges and threatens global safety and security Nick Fury director of the international peacekeeping agency known as S.H.I.E.L.D. finds himself in need of a team to pull the world back from the brink of disaster. Spanning the globe a daring recruitment effort begins!
17,B000GIOPK2,EvFan17,Im not sure why Drawn Together was cancelled but it needs to be back on tv and stay on tv forever cuz this show is funny and awesome. As a fan of Drawn Together this show is amazing and for anyone who has not herd of this show needs to look it up. Drawn Together is an amazing show and i support Drawn Together forever!,5,Awesome show !,1,Pirates of the Caribbean: On Stranger Tides,Captain Jack Sparrow crosses paths with a woman from his past and he's not sure if it's love -- or if she's a ruthless con artist who's using him to find the fabled Fountain of Youth. When she forces him aboard the Queen Anne's Revenge the ship of the formidable pirate Blackbeard Jack finds himself on an unexpected adventure in which he doesn't know who to fear more: Blackbeard or the woman from his past.
18,B000GIOPK2,"Faith Speed ""Mother Roar""",Drawn Together is for MATURE ADULT audiences ONLY!!! Full frontal nudity male and female adult situations sexual scenes language extreme violence etc. I Love Drawn Togetherit is hilarious  but we only watch it at night when the kids are in bed. They can't see or hear any of it! But we are fans!!!!!!!,5,Drawn Together,1,Men in Black 3,Agents J (Will Smith) and K (Tommy Lee Jones) are back...in time. J has seen some inexplicable things in his 15 years with the Men in Black but nothing not even aliens perplexes him as much as his wry reticent partner. But when K's life and the fate of the planet are put at stake Agent J will have to travel back in time to put things right. J discovers that there are secrets to the universe that K never told him - secrets that will reveal themselves as he teams up with the young Agent K (Josh Brolin) to save his partner the agency and the future of humankind.
19,B000GIOPK2,"Hallur Hallsson ""HH-0436""",This one takes Season one and ramps it up .The jokes are dirtier funnier and not getting stale at all. 12 year old and a donkey jokes makes a comeback and I loved the series.,5,"Dirty, funny and a shame they ended in season 3",1,The Hobbit: The Battle of the Five Armies,Immediately after the events of The Desolation of Smaug Bilbo and the dwarves try to defend Erebor's mountain of treasure from others who claim it: the men of the ruined Laketown and the elves of Mirkwood. Meanwhile an army of Orcs led by Azog the Defiler is marching on Erebor fueled by the rise of the dark lord Sauron. Dwarves elves and men must unite and the hope for Middle-Earth falls into Bilbo's hands.
20,B000GIOPK2,"James William Johnston ""ACE29""",more great laughs picking up where the 1st season left off. 3 seasons. collect the whole set its worth it. go captain hero!,5,DT2,1,The Amazing Spider-Man,Peter Parker is an outcast high schooler abandoned by his parents as a boy leaving him to be raised by his Uncle Ben and Aunt May. Like most teenagers Peter is trying to figure out who he is and how he got to be the person he is today. As Peter discovers a mysterious briefcase that belonged to his father he begins a quest to understand his parents' disappearance – leading him directly to Oscorp and the lab of Dr. Curt Connors his father's former partner. As Spider-Man is set on a collision course with Connors' alter ego The Lizard Peter will make life-altering choices to use his powers and shape his destiny to become a hero.
21,B000GIOPK2,jamie rivera,One of the funniest shows ever insane and in your face! great price for this dvd collection cant wait to get season 3!,5,still wildly funny,1,Robin Hood,When soldier Robin happens upon the dying Robert of Loxley he promises to return the man's sword to his family in Nottingham. There he assumes Robert's identity; romances his widow Marion; and draws the ire of the town's sheriff and King John's henchman Godfrey.
22,B000GIOPK2,Jo Ann Mcbride,You have to love the Drawn Together series to own this.,5,Five Stars,1,The Hobbit: The Desolation of Smaug,The Dwarves Bilbo and Gandalf have successfully escaped the Misty Mountains and Bilbo has gained the One Ring. They all continue their journey to get their gold back from the Dragon Smaug.
23,B000GIOPK2,"Karen James ""Musicfan""",The fans of Drawn Together have waited so long for this DVD to come out and let me tell you it's was well worth the wait!In this uncut and uncensored DVD we get to see something that I had waited for since the show began we get to hear Xandir sing however he doesn't sing very long and sounds like a cat being killed plus we see him in the nude.I absolutely love the commentary and deleted scenes along with the cast interviews they were  such a crack up!It's fun to see the cartoons we grew up with be parodied in this sick but funny as hell adult cartoon!,5,Drawn Together Season 2,1,The Golden Compass,After overhearing a shocking secret precocious orphan Lyra Belacqua trades her carefree existence roaming the halls of Jordan College for an otherworldly adventure in the far North unaware that it's part of her destiny.
24,B000GIOPK2,Ken,So disturbing so disgusting so over-the-top.  So great.,5,Raunchy goodness,1,King Kong,In 1933 New York an overly ambitious movie producer coerces his cast and hired ship crew to travel to mysterious Skull Island where they encounter Kong a giant ape who is immediately smitten with the leading lady.
25,B000GIOPK2,montrell,I always live this show because they do an day the crazyist things in shows its very funny to me,4,Very funny,1,Titanic,84 years later a 101-year-old woman named Rose DeWitt Bukater tells the story to her granddaughter Lizzy Calvert Brock Lovett Lewis Bodine Bobby Buell and Anatoly Mikailavich on the Keldysh about her life set in April 10th 1912 on a ship called Titanic when young Rose boards the departing ship with the upper-class passengers and her mother Ruth DeWitt Bukater and her fiancé Caledon Hockley. Meanwhile a drifter and artist named Jack Dawson and his best friend Fabrizio De Rossi win third-class tickets to the ship in a game. And she explains the whole story from departure until the death of Titanic on its first and last voyage April 15th 1912 at 2:20 in the morning.
26,B000GIOPK2,"M. Sellers ""Fade To ALS""",I haven't laughed this hard and at the same time been totally offended I love this series I have the first 3 seasons,5,Drawn Together 2,1,Captain America: Civil War,Following the events of Age of Ultron the collective governments of the world pass an act designed to regulate all superhuman activity. This polarizes opinion amongst the Avengers causing two factions to side with Iron Man or Captain America which causes an epic battle between former allies.
27,B000GIOPK2,"N. Durham ""Big Evil""",The second season of Comedy Central's animated reality TV spoofing Drawn gets off to a great start but sadly it wears thin the further it goes on. All in all though if you enjoy the show for what it's worth despite it's flaws this DVD set is definitely worth picking up regardless.,3,"Funny in the beginning, but wears thin",0,Battleship,When mankind beams a radio signal into space a reply comes from ‘Planet G’ in the form of several alien crafts that splash down in the waters off Hawaii. Lieutenant Alex Hopper is a weapons officer assigned to the USS John Paul Jones part of an international naval coalition which becomes the world's last hope for survival as they engage the hostile alien force of unimaginable strength. While taking on the invaders Hopper must also try to live up to the potential his brother and his fiancée's father Admiral Shane expect of him.
28,B000GIOPK2,Nurse Palmer,The product arrived promptly as stated by Amazon.  Drawn Together is very funny.  Not for the faint hearted.  If you like your humour crude and full frontal this is the season dvd for you.  I loved it  very funny.,4,Very funny and borderline offensive,1,Jurassic World,Twenty-two years after the events of Jurassic Park Isla Nublar now features a fully functioning dinosaur theme park Jurassic World as originally envisioned by John Hammond.
29,B000GIOPK2,"R. Kline ""utgirl28""",I received product very promptly and before my Hubby's birthday he was very surprised.  We have been looking for this item for awhile and I am glad once again Amazon was able to come thru.,4,birthday gift for husband,1,Skyfall,When Bond's latest assignment goes gravely wrong and agents around the world are exposed MI6 is attacked forcing M to relocate the agency. These events cause her authority and position to be challenged by Gareth Mallory the new Chairman of the Intelligence and Security Committee. With MI6 now compromised from both inside and out M is left with one ally she can trust: Bond. 007 takes to the shadows - aided only by field agent Eve - following a trail to the mysterious Silva whose lethal and hidden motives have yet to reveal themselves.
