,asin,reviewerName,reviewText,overall,summary,post_neg,original_title,overview
195,B000H00VBQ,Lisa Watson,Wire in the Blood is back in full force with an excellent season - great stories well told & full of intrigue.  The extras on Disc 1 are also worth watching as they provide some interesting insights into the entire series.,5,Another Winner for WITB Fans,1,Night at the Museum: Secret of the Tomb,When the magic powers of The Tablet of Ahkmenrah begin to die out Larry Daley (Ben Stiller) spans the globe uniting favorite and new characters while embarking on an epic quest to save the magic before it is gone forever.
196,B000H00VBQ,"Literally Literate ""Jc""",Robson embellishes any movie he is in regardless of the quality of the rest of it. I love having him to myself in TOUCHING EVIL and WIRE IN THE BLOOD series. As another reviewer stated he has perfected the role ([bleeding heart psychiatrist]) who seems less afraid but rather enchanted with the illnesses of his patients. He empathizes with how they got the way they are instead of despising them for how they evolved from their molding circumstances. Without condescention he faces the bad (the killer) and the good (the police and innocent victims) without judging either. That could make him appear apathetic or stoic but doesn't because of the way he has a grip on the role he plays (compassionate!). I have all of the captioned above and hope the rumors aren't true that this is the last of WIRE....But if it is I'll be looking forward to whatever he does next!,5,Robson Green FAN-atic,1,Megamind,Bumbling supervillain Megamind finally defeats his nemesis the superhero Metro Man. But without a hero he loses all purpose and must find new meaning to his life.
197,B000H00VBQ,"Magdalena ""mystery cravings""",All four episodes on this series are very different yet connected by the invisible thread of the two main character's vulnerable relationship.  Their relationship crosses from the strictly professional to the personal-not as a couple-but as two human beings with personal issues who can't help but to yield to our need to connect to those closer to us.  The episodes are gripping any case involving children are nerve wrecking and potentially heart breaking the third episode has an unexpected end and the last one is frightening for it's possibilities so all the episodes are very intense. Tony's knowledge of human nature is fascinating-rarely found such remarkable writing. Beautifully shot.  Love the Smart Board and Kevin and Paula's very casual attire.,5,It get's better,1,Harry Potter and the Philosopher's Stone,Harry Potter has lived under the stairs at his aunt and uncle's house his whole life. But on his 11th birthday he learns he's a powerful wizard -- with a place waiting for him at the Hogwarts School of Witchcraft and Wizardry. As he learns to harness his newfound powers with the help of the school's kindly headmaster Harry uncovers the truth about his parents' deaths -- and about the villain who's to blame.
198,B000H00VBQ,"Margue L. Hunt ""MargueHF""",The complex thrillers that Val McDermid writes must be very difficult to transfer to the screen but they have done well. Robson Green IS Dr. Tony Hill and the pure evil of those he chases is reflected just enough to indicate the level of disturbance represented in the books. Must see for mystery and psychological thriller fans.,5,Val McDermid's Great Tony Hill,1,R.I.P.D.,A recently slain cop joins a team of undead police officers working for the Rest in Peace Department and tries to find the man who murdered him. Based on the comic by Peter M. Lenkov.
199,B000H00VBQ,"M. Bailey ""Quotizmo""",Great show. First episode pulled me right in. Can't watch episode two even though I paid for it. They might have mentioned that it wasn't available for the iPad before selling it to me on my iPad.,5,Don't buy for tablet devices,1,Pirates of the Caribbean: The Curse of the Black Pearl,Jack Sparrow a freewheeling 17th-century pirate who roams the Caribbean Sea butts heads with a rival pirate bent on pillaging the village of Port Royal. When the governor's daughter is kidnapped Sparrow decides to help the girl's love save her. But their seafaring mission is hardly simple.
200,B000H00VBQ,Michael Dobey,"This show always is excellent as far as british crime or mystery showsgoes this is one of the best ever made.  The stories are well done and the acting is top notch with interesting twists in the realistic and brutal storylines.  This show pulls no punches as it enters into the twisted minds of criminals and the profiler psychiatrist who helps out in a northern english city police force. The show looks like it is shot in Manchester but it is called by another name in the show.  One episode is not on this disc the excellent 'prayer of the bone"" which is on a seperate disc.  Still crime shows don't get much better than this one on either side of the ocean.  It's just a great show that never has had a less than well made episode. Unfortunately like all British shows you only get about five shows a year   but these are an hour and a half shows  still one could hope for at least 8 of these a year.  The realism and depth of the main character Tony Hill as protrayed by the excellent Robson Green is well worth viewing because he just makes this role truly part of himself in everyway.  I bet he went to crime scenes even in real life to research his role.  But the writers too must be applauded for their way above average stories.  Lets hope this show continues on for many years to come.",5,Robson green and great writing,1,The Hunger Games: Mockingjay - Part 1,Katniss Everdeen reluctantly becomes the symbol of a mass rebellion against the autocratic Capitol.
201,B000H00VBQ,phantomfan,"I've been a sort of halfhearted fan of this series since season one but season five finally won me over completely. The stories are especially compelling and original this time and less ""demented"" (despite the quote on the box!) than previous seasons. Each episode is written produced and directed in an entirely different style e.g. the first one is fast-paced with the camera never alighting for more than a few seconds while the second one is very grainy jumpy and almost completely colorless; the last episode is a bit over saturated with color giving it a sort of surreal look. This is somewhat daring but it works extremely well.Another strength of this season is the character of Alex. I really liked Carol but Alex is at least as compelling if not more so. Also Kevin and Paula as the ""minor"" characters are superbly well written and well acted.And then there's Tony who is my ""small exception."" He's as charming and likeable as ever if not more so and seems to have become a bit more compassionate and considerate of other people. (I was thoroughly charmed by the popcorn-with-Ben scene!) But a little of his eccentricity is gone. We don't really see just how much of a complete oddball he is. However they more than made up for it in ""Prayer of the Bone"" so I can't really even call it a flaw.If you like a truly suspenseful intelligent multi-layered drama but previous episodes have left you uncertain about watching this series give season five a try.",5,"The best season yet, with one small exception",1,The Da Vinci Code,When the curator of the Louvre is found murdered in the famed museum's hallowed halls Harvard professor Robert Langdon and cryptographer Sophie Neve must untangle a deadly web of deceit involving the works of Leonardo da Vinci.
202,B000H00VBQ,Philip J. Herman,read  the other review for a good overview of the series. I just want to add a few things. I am a fan of Sherlock Holmes and I watched all of the American CSI programs and House. I recently watched all the Inspector Lewis series and a few other Masterpiece Mysteries. I enjoy this show more than all of them. Maybe it's the chemistry between Tony and Carol I don't know. I feel sublime when I am watching them. I even grew to love the theme music. I felt really sad at the end of the 23rd episode.,5,"excellent, disturbing, enthralling, habit-forming, fantastic",1,Rio 2,It's a jungle out there for Blu Jewel and their three kids after they're hurtled from Rio de Janeiro to the wilds of the Amazon. As Blu tries to fit in he goes beak-to-beak with the vengeful Nigel and meets the most fearsome adversary of all: his father-in-law.
203,B000H00VBQ,P. Klusman,This British crime drama is riveting.  The star Robson Green appears in another BBC drama.  He is an amazing actor and plays a psychiatrist who assists the police as a proviler.  This series was truly excellent.,5,Truly Wonderful Viewing,1,X2,Professor Charles Xavier and his team of genetically gifted superheroes face a rising tide of anti-mutant sentiment led by Col. William Stryker. Storm Wolverine and Jean Grey must join their usual nemeses –  Magneto and Mystique – to unhinge Stryker's scheme to exterminate all mutants.
204,B000H00VBQ,Ron West,It's difficult to avoid superlatives here. Production values acting narrative all add to the series's early development and to the growth of the ensemble characters particularly Hermione Norris's (then) DI Carol Jordan and of course Robson Green's portrayal of Tony Hill. As with all of the series though all of the core characters gain some detail. The cinematography deserves some notice as well particularly as this DP Dominic Clemence avoids the hand-held excesses that crop up and intrude with some later DPs. The visual element combination of scenic with close work contribute a great deal to the specific story but also add to a continued sense of mood and atmosphere. The care in production and editing doesn't jump into the foreground as it shouldn't but gives the action an excellent context. Ironically one of the producers has commented repeatedly that they long to replicate the work of American crime drama but this series is an excellent example of what the US could produce but doesn't.,5,Hard to over-rate,1,Fast Five,Former cop Brian O'Conner partners with ex-con Dom Toretto on the opposite side of the law. Since Brian and Mia Toretto broke Dom out of custody they've blown across many borders to elude authorities. Now backed into a corner in Rio de Janeiro they must pull one last job in order to gain their freedom.
205,B000H00VBQ,"Royali ""Merlis""",I really like this original and clever show. I have a question though - where is a first episode of the fifth season? It was shot in Texas and was about american soldier with PTSD. BBC site gives a full description of the Episode One: Prayer of the Bone . Why the season called full if one episode is missing? If anyone knows the answer I would be very interested to know.,5,great show but one episode missing from 5th season,1,Sherlock Holmes: A Game of Shadows,There is a new criminal mastermind at large (Professor Moriarty) and not only is he Holmes’ intellectual equal but his capacity for evil and lack of conscience may give him an advantage over the  detective.
206,B000H00VBQ,"sadiayah ""youngadults99""",I caught an episode of Wire in the Blood - Nocebo as a rerun on HBO. I am completely won over by this intricate crime drama. I would recommend this show to anyone tired and bored by the endless stream of mindless trival 'reality' shows to get into this program to challenge their mind and engage the active part of their brain. Cast was well chosen and act as though this is not a program but real crime drama. Not wooden but includes little pieces of their lives away from the crime scene. A must see program. Robson Green is a superb actor. Not too know it all but human to make mistakes and regret them. Excellent,5,One of the best series made,1,Clash of the Titans,Born of a god but raised as a man Perseus is helpless to save his family from Hades vengeful god of the underworld. With nothing to lose Perseus volunteers to lead a dangerous mission to defeat Hades before he can seize power from Zeus and unleash hell on earth. Battling unholy demons and fearsome beasts Perseus and his warriors will only survive if Perseus accepts his power as a god defies fate and creates his own destiny.
207,B000H00VBQ,Stephanie De Pue,"""Wire in the Blood Season 5"" is the latest installment of the British television mystery serial based on the works of Val McDermid to reach these shores.  The series a police procedural that stars Robson Green as psychologist Dr. Tony Hill criminal profiler is produced by Green's production company for the British Granada TV: he's one of their biggest domestic stars; and the series is surely tailored to his many strengths.  It has been shown here on BBC America; but it is lacking the last episode of the series as shown here which has been spun off as a standalone.In addition to Green the series stars longtime regulars Mark Letheren as Detective Sergeant Kevin Geoffries and Emma Handy as Detective Constable Paula McIntyre.  Simone Lahbib continues her more recent duties as Detective Inspector Alex Fielding Hill's foil romantic and otherwise.  This season as most is simply advertised as ""based on characters created by"" McDermid and there is not a single episode based on one of her books. However the episodes presented are of a fairly high quality solid mysteries with some of the well-known author's intensity; some of her edginess and grit and her ability to break new ground.  McDermid of course is a leading light of the British mystery writing school known as tartan noir: and what's that when it's at home you may ask.  Unusually bloody and violent lightened a bit by that dark Scots humor.  Written (duh!!) by a Scot which McDermid is Scots-born.At any rate the series is set in McDermid's fictional ""Bradfield"" it is filmed in Manchester the actual city in which she sets her work after doing 16 years there as a journalist.  Manchester's an interesting city to use: handsome and hardly ever seen here full of interesting looking architecture with a highly diverse population.  Unfortunately the cast has been encouraged to make use of the local accent and dialect and there are no subtitles a puzzling oversight considering Green's standing at Granada.  It makes the series quite difficult to follow for us on these shores.1. ""Colour of Amber.""  A white man appears to have kidnapped a young black girl on a busy street in the morning rush hour.  A strong complex mystery dealing with interracial matters; focusing on children damaged by the adults in their lives.2. ""Nocebo.""  A sadistic ritualistic killer seems to be at work targeting children.  Another strong intense episode more daring in its treatment of blacks than an American tv program would ever be giving us a really unflattering portrait of a black voodoo-oriented preacher Dr.Kingston.3. ""Names of Angels."" A serial killer seems to be targeting attractive blond young businesswomen.  A clever perhaps too clever outing.  Notable chiefly for the introduction of a character clearly based on one of the ten-year olds who tortured and killed two-year old James Bulger in Liverpool in February 1993.  ""Christopher"" has been a patient of Hill's while imprisoned for the crime and as he was so young when he committed it he is being released as a young man.  Hill is greatly concerned with his well-being.4. ""Anything You Can Do."" Yet another apparent serial killer at work putting bags over the heads of his victims.  Another clever one but a good mystery that once again ventures where American TV will never go.  Continues the sad arc of ""Christopher"" the released Liverpool child murderer.Green is of course a handsome man and a good actor and he gives us an intense intelligent portrait of Dr. Hill.  If only we could make out what he's saying.",4,If Only We Could Make Out What They're Saying,1,Total Recall,Construction worker Douglas Quaid discovers a memory chip in his brain during a virtual-reality trip. He also finds that his past has been invented to conceal a plot of planetary domination. Soon he's off to Mars to find out who he is and who planted the chip.
208,B000H00VBQ,Susan Rhodes,I love the series!  However I was very disappointed that it isn't closed captioned.  All of the other BBC televised series have been.  I wish I hadn't purchased it.,4,No Closed Captioning!,1,The 13th Warrior,In AD 922 Arab courtier Ahmad Ibn Fadlan accompanies a party of Vikings to the barbaric North to combat a terror that slaughters Vikings and devours their flesh.
209,B000H00VBQ,Terence,I think wire in the blood has been my top favorite in all the series shows that I have watch  coming close to a near tie with Downton Abbey which I adored.  At first I thought the character was too fast for me to keep up but once I started watching more episodes its like I just want to see more of this series  I hope there is more to come.,5,so far my all time favorite,1,The Bourne Legacy,New CIA operative Aaron Cross experiences life-or-death stakes that have been triggered by the previous actions of Jason Bourne.
210,B000H00VBQ,trv215,Awesome series!  Robson Green never ceases to amaze me; he outdoes himself in Wire In The Blood - ALL of the complete seasons!  Watch them all; not only the first.,5,Robson is amazing!,1,Batman & Robin,Along with crime-fighting partner Robin and new recruit Batgirl Batman battles the dual threat of frosty genius Mr. Freeze and homicidal horticulturalist Poison Ivy. Freeze plans to put Gotham City on ice while Ivy tries to drive a wedge between the dynamic duo.
211,B000H00VBQ,"WebScribe ""webscribes""","Just so you know!!!Episode One: Prayer of the Bone was considered a ""special"" and is not included in the Season 5 Set. It is scheduled to be released as a separate DVD on August 5th 2008. Each episode is about 83 minutes in length. This is a quality series that seems to improve each year as the character delvelopment matures.~ ~ SEASON 5 EPISODES ~ ~Episode One: Prayer of the BoneIn the season premiere Dr. Tony Hill (Robson Green) finds himself a fish out of water when he's invited to Texas as an expert witness in a case where an Iraq combat veteran has confessed to brutally slaughtering his wife and two young children. His defense team claims that he's suffering from Post-Traumatic Stress Disorder but the prosecution asks Tony who met with the soldier in the UK to join them in disproving that claim. Alone in a strange country surrounded by hostile lawyers and police Tony finds himself at the center of a death penalty case with competing legal and political interests. He's insulted threatened framed and physically attacked while the case takes a strange turn. Everyone seems to have a vested interest in the case - everyone except the suspect who strangely seems determined to die.Episode Two: The Color of AmberWhen a woman sees a young girl being snatched by a man in a car DI Alex Fielding (Simone Lahbib) fears they may only have hours to get her back alive. Since only one percent of the victims in abduction cases survive beyond a day new ACC James Morrison (Christopher Colquhoun) reacts by calling an Amber alert which floods the media with public pleas for information. He also pulls Tony in to help with profiling likely abductors.Episode Three: NoceboAlex investigates the murder of a teenage girl and a young boy who bear signs of ritual killings. The trail leads to a property tycoon who'll stop at nothing to get the rent a preacher whose healing activities involve animal sacrifice and a self-styled artist whose works not only depict violence but are painted in blood. Tony puzzles over what the killer might want to gain and why. Is this religion? And is it one killer or two with one suspect the acolyte of another?Episode Four: The Names of AngelsTwo women are found raped and strangled wearing the clothing of victims killed years earlier in Europe. Is the killer boasting to police about past crimes leaving bodies where they can easily be found? And why is he choosing victims from the business world? As Tony tries to unravel the deadly puzzle he's confronted by an unpleasant distraction - an 18-year-old released killer turns up on his doorstep.Episode Five: Anything You Can DoWhen a vulnerable elderly woman is suffocated in her home Alex and Tony suspect Bernard Kelly (Ian Peck) a security guard who has a dysfunctional relationship with his mother and was seen at the scene of the crime by several witnesses. But when the killings escalate it appears to be the work of more than one murderer. Could the deaths be connected to the sudden return of Tony's old hero respected psychologist Jonathan Goode?. . .",5,Only 4 of the 5 episodes included in this set,1,How the Grinch Stole Christmas,Inside a snowflake exists the magical land of Whoville. In Whoville live the Whos an almost mutated sort of Munchkin-like people. All the Whos love Christmas yet just outside of their beloved Whoville lives the Grinch. The Grinch is a nasty creature that hates Christmas and plots to steal it away from the Whos whom he equally abhors. Yet a small child Cindy Lou Who decides to try befriending the Grinch.
212,B000H00VBQ,windstormy,I first fell in love with Robson Green from watching him in another series. When I came across Wire In the Blood I was so excited to be able to view him again and in a series that was similar yet different enough for me to grow along with him as a character.,5,"Wire is an original, not in the mainstream known series",1,The Day After Tomorrow,After years of increases in the greenhouse effect  havoc is wreaked globally in the form of catastrophic hurricanes tornadoes tidal waves floods and the beginning of a new Ice Age. Paleoclimatologist Jack Hall tries to warn the world while also shepherding to safety his son trapped in New York after the city is overwhelmed by the start of the new big freeze.
213,B000H00VBQ,W. S. Ward,Every Season is GREAT.  If you like British Mysteries  this is for you !,5,Wire in the Blood,1,Mission: Impossible II,With computer genius Luther Stickell at his side and a beautiful thief on his mind agent Ethan Hunt races across Australia and Spain to stop a former IMF agent from unleashing a genetically engineered biological weapon called Chimera. This mission should Hunt choose to accept it plunges him into the center of an international crisis of terrifying magnitude.
214,B000H00VBQ,"Yvette R. Durham ""Renee""",Enjoyed this product very much. I enjoyed the increasing involment between DI Fielding and the lead character. The chemistry is increasing the longer they spend together. I also liked that we got to see a  little more of DI Fielding's personal life in this chapter.,5,Renee,1,The Perfect Storm,In October 1991 a confluence of weather conditions combined to form a killer storm in the North Atlantic. Caught in the storm was the sword-fishing boat Andrea Gail. Magnificent foreshadowing and anticipation fill this true-life drama while minute details of the fishing boats their gear and the weather are juxtaposed with the sea adventure.
