,asin,reviewerName,reviewText,overall,summary,post_neg,original_title,overview
89,B000GK6NFK,"J. Smith ""Maven""","So I got My South Of Nowhere DVD in the mail today i havent watched the episodes yet but i wanted to look at the main menu on the dvd and it doesnt have any type of beggining credits or anything the dvd menu just plops right up and its very plain and boring.(my brother was even in the room and said ""degrassi's menu looks way better why does this look so bad"") and im thinking mabey cause it wasnt presented under a major label thats why it is so cheap lookingcause i think amazon.com is the ones selling this dvd..as for the quality in the episodes i dont kno yet because i havent watched any but I've heard that the Picture is reallyreally good! the show itse;f is very realisitic and even though degrassi is too degrassi can be very dramatic someitmes...but this show keeps it very cut-dry and even the language used in today is portrade the same.All in all its worth buying (so isnt buying season 2 & 3 )which are being mailed to me as we speak...ahaha Just thought i would share my opinion...so go out and buy it!",4,South Of Nowhere Is Historic!,1,Wreck-It Ralph,Wreck-It Ralph is the 9-foot-tall 643-pound villain of an arcade video game named Fix-It Felix Jr. in which the game's titular hero fixes buildings that Ralph destroys. Wanting to prove he can be a good guy and not just a villain Ralph escapes his game and lands in Hero's Duty a first-person shooter where he helps the game's hero battle against alien invaders. He later enters Sugar Rush a kart racing game set on tracks made of candies cookies and other sweets. There Ralph meets Vanellope von Schweetz who has learned that her game is faced with a dire threat that could affect the entire arcade and one that Ralph may have inadvertently started.
90,B000GK6NFK,J. T. Sheldon,"at first i was afraid to buy this dvd set because of some of the reviews including the one talking about how they changed the theme song. but overall i'm glad i bought seasons 1 and 2 of south of nowhere. while the origonal theme song by the donna's WAS better suited and despite how much i hate to say this... i love the new theme. *waits for people to groan* the first time i heard it i was like ""ew"" but then as time went on i fell in love with it singing along and making my mom give me weird looks :Pthere are no special feautures on either season 1 and 2 but i didn't think SoN was going to ever be released on dvd so the fact that is IS and that all the episodes are here well that's good enough for me. they just better release season 3 too or i'm gonna be pissed.P.S. - (season 2's theme is the same ""wasted"" by L.P.)",3,this is the time to fly (DVD review),0,The Polar Express,When a doubting young boy takes an extraordinary train ride to the North Pole he embarks on a journey of self-discovery that shows him that the wonder of life never fades for those who believe.
91,B000GK6NFK,Juan Sanchez,I loved that show since the first time I saw it. The only thing I didn't like is that they changed the opening song. Wonderful show.,4,South of Nowhere,1,Independence Day: Resurgence,We always knew they were coming back. Using recovered alien technology the nations of Earth have collaborated on an immense defense program to protect the planet. But nothing can prepare us for the aliens’ advanced and unprecedented force. Only the ingenuity of a few brave men and women can bring our world back from the brink of extinction.
92,B000GK6NFK,Karen,I have been looking for this show in it's entirety. It is a very good qualitydoes not skip or freeze.,5,Good Quality,1,How to Train Your Dragon,As the son of a Viking leader on the cusp of manhood shy Hiccup Horrendous Haddock III faces a rite of passage: he must kill a dragon to prove his warrior mettle. But after downing a feared dragon he realizes that he no longer wants to destroy it and instead befriends the beast – which he names Toothless – much to the chagrin of his warrior father
93,B000GK6NFK,Katie Pittman,I loved it the first time I saw this season. The cast was amazing and the season was very well put together.,5,South of Nowhere Rocks,1,Terminator 3: Rise of the Machines,It's been 10 years since John Connor saved Earth from Judgment Day and he's now living under the radar steering clear of using anything Skynet can trace. That is until he encounters T-X a robotic assassin ordered to finish what T-1000 started. Good thing Connor's former nemesis the Terminator is back to aid the now-adult Connor … just like he promised.
94,B000GK6NFK,Kizzy M. Davis,for a new series its pretty good hell who am i kidding i loved it.,4,pretty good,1,Guardians of the Galaxy,Light years from Earth 26 years after being abducted Peter Quill finds himself the prime target of a manhunt after discovering an orb wanted by Ronan the Accuser.
95,B000GK6NFK,klazmom,Not quite what I was expecting the acting is not that great hopefully that will improve over the next seasons. ,2,Not what I was expecting,0,Interstellar,Interstellar chronicles the adventures of a group of explorers who make use of a newly discovered wormhole to surpass the limitations on human space travel and conquer the vast distances involved in an interstellar voyage.
96,B000GK6NFK,Laina,Package arrived on time and in perfect condition. DVD's played perfectly and I would definitely buy from this seller again.,5,Laina's Review for SON S1,1,Inception,"Cobb a skilled thief who commits corporate espionage by infiltrating the subconscious of his targets is offered a chance to regain his old life as payment for a task considered to be impossible: ""inception"" the implantation of another person's idea into a target's subconscious."
97,B000GK6NFK,laynea,This show is a little corny at first but gets better and better as it goes on. It really just sucks you in.,5,Intriguing,1,Godzilla,From the mind behind Evangelion comes a hit larger than life.  When a massive gilled monster emerges from the deep and tears through the city the government scrambles to save its citizens.  A rag-tag team of volunteers cuts through a web of red tape to uncover the monster's weakness and its mysterious ties to a foreign superpower.  But time is not on their side - the greatest catastrophe to ever befall the world is about to evolve right before their very eyes.
98,B000GK6NFK,L. Kaufman,Season 1 is about moving to a new place and lots of self discovery. Great show I highly recommend it. Very realistic unlike The L world which is mostly fantasy.,5,Loved season 1. Discovery is a wonderful thing!,1,The Hobbit: An Unexpected Journey,Bilbo Baggins a hobbit enjoying his quiet life is swept into an epic quest by Gandalf the Grey and thirteen dwarves who seek to reclaim their mountain home from Smaug the dragon.
99,B000GK6NFK,"Louise ""Lulu Tripp""",Why on earth did Season Two come out/arrive before Season One? It seriously makes no sense whatsoever. I have Season Two but I want to watch them (again) in order darnit.Heh anyway. I love this show...,4,Can somebody please tell me...,1,The Fast and the Furious,Domenic Toretto is a Los Angeles street racer suspected of masterminding a series of big-rig hijackings. When undercover cop Brian O'Conner infiltrates Toretto's iconoclastic crew he falls for Toretto's sister and must choose a side: the gang or the LAPD.
100,B000GK6NFK,Maria,I just started watching this show recently and i was instantly hooked. If i was rating the show itself i would have given 5 stars. however the dvd set available here is satisfactory. it is made to order and when i received mine in the mail they were all scratched up. It skips in a spot which is irritating. overall i would still buy this because i would rather deal with a few imperfections than not own the show at all.,4,Love This Show!,1,The Curious Case of Benjamin Button,Tells the story of Benjamin Button a man who starts aging backwards with bizarre consequences.
101,B000GK6NFK,"Melissa S. Austin ""Melissa Austin &#34;girl l...",This show was amazing as it tells the story of the Carlins. Paula the mom Arthur the dad Glenn the oldest brother Clay the adopted black brother and Spencer whom the show focuses most of it's attention on. I wish this had come out years earlier when I was questioning my own sexuality. It deals with the relationship of Spencer Carlin and Ashley Davies. Paula has a hard time accepting Ashley for being a lesbian and Spencer's best friend. The Carlins are a catholic family who moves from Ohio to Los Angeles CA. Although it's a teen show that shows sexuality differences there are other characters as well as their relationships. A definite recommend.,5,Great for the questioning of sexuality.,1,X-Men: First Class,Before Charles Xavier and Erik Lensherr took the names Professor X and Magneto they were two young men discovering their powers for the first time. Before they were arch-enemies they were closest of friends working together with other mutants (some familiar some new) to stop the greatest threat the world has ever known.
102,B000GK6NFK,mini10z,It has such a great story and characters i think it is a must see if your in to romantic love storys after i saw an episode i couldnt stop watching them,5,Best Teen Show Ive Seen,1,The Hunger Games: Mockingjay - Part 2,With the nation of Panem in a full scale war Katniss confronts President Snow in the final showdown. Teamed with a group of her closest friends – including Gale Finnick and Peeta – Katniss goes off on a mission with the unit from District 13 as they risk their lives to stage an assassination attempt on President Snow who has become increasingly obsessed with destroying her. The mortal traps enemies and moral choices that await Katniss will challenge her more than any arena she faced in The Hunger Games.
103,B000GK6NFK,"Nancy L. Manning ""nmanning""",I love Splashley! I watched all these before and loved the series. I love having these in my collection. Good service also!!!,5,Love it,1,The Sorcerer's Apprentice,Balthazar Blake is a master sorcerer in modern-day Manhattan trying to defend the city from his arch-nemesis Maxim Horvath. Balthazar can't do it alone so he recruits Dave Stutler a seemingly average guy who demonstrates hidden potential as his reluctant protégé. The sorcerer gives his unwilling accomplice a crash course in the art and science of magic and together these unlikely partners work to stop the forces of darkness.
104,B000GK6NFK,N. Nerode,"CONSUMER WARNING.The series is great.  The DVD picture quality is also quite good and it is nice not to have network adverts crawling across the screen.However I cannot give a good rating to a DVD set which hacks up the original show.  If you're really a fan you will consider this to be a low-quality defective release and you may consider it inferior to off-air copies.The theme music has been completely replaced with a different song.  This should have been noted on the description; yet another case of false advertising in DVDs.  The original song is of course much more appropriate and better.There may be other unidentified cuts and alterations as the series used a lot of rather expensive music.The versions on Amazon Unbox and iTunes have the same cuts.The DVDs have several mastering errors; the ""choose episode"" option simply doesn't work.",2,"Great series, offensive DVD release",0,Poseidon,A packed cruise ship traveling the Atlantic is hit and overturned by a massive wave compelling the passengers to begin a dramatic fight for their lives.
105,B000GK6NFK,Paige5225,It took me forever to be able to find this television serious and I couldn't be happier.  This is one of the best drama series to ever be played on the N.  I was really excited to receive this season I would recommend this to anyone !,5,Yay,1,Alice Through the Looking Glass,"In the sequel to Tim Burton's ""Alice in Wonderland"" Alice Kingsleigh returns to Underland and faces a new adventure in saving the Mad Hatter."
106,B000GK6NFK,Paiggeerr,I was very excited to find this season since I had been thinking about the show for months. Once I found it I got to re-watch the episodes and it made me remember high school. Loved this show. Still do!,5,Very Good,1,Shrek the Third,The King of Far Far Away has died and Shrek and Fiona are to become King &amp; Queen. However Shrek wants to return to his cozy swamp and live in peace and quiet so when he finds out there is another heir to the throne they set off to bring him back to rule the kingdom.
107,B000GK6NFK,paul,it was a very open at the begining about young people coming to terms with there sexualitybut starts to get a bit melodramatic as it goes on.,5,it was a good soapy,1,Warcraft,The peaceful realm of Azeroth stands on the brink of war as its civilization faces a fearsome race of invaders: orc warriors fleeing their dying home to colonize another. As a portal opens to connect the two worlds one army faces destruction and the other faces extinction. From opposing sides two heroes are set on a collision course that will decide the fate of their family their people and their home.
108,B000GK6NFK,rachel dwyer,South of Nowhere: Season One. i love south of nowhere it's my faviter. i love love it. so dis my friends,5,south of nowhere,1,Terminator Genisys,The year is 2029. John Connor leader of the resistance continues the war against the machines. At the Los Angeles offensive John's fears of the unknown future begin to emerge when TECOM spies reveal a new plot by SkyNet that will attack him from both fronts; past and future and will ultimately change warfare forever.
109,B000GK6NFK,rebecca,the best series ever wish it never ended. but at least i can have a copy in my library of movies,5,great,1,The Chronicles of Narnia: The Voyage of the Dawn Treader,This time around Edmund and Lucy Pevensie along with their pesky cousin Eustace Scrubb find themselves swallowed into a painting and on to a fantastic Narnian ship headed for the very edges of the world.
110,B000GK6NFK,renee,This series was recommened to me and I found it to be the biggest waste of time and moneyI thought that maybe if I persisted with it it would get better man was I wrong.,1,south of nowhere,0,Pearl Harbor,The lifelong friendship between Rafe McCawley and Danny Walker is put to the ultimate test when the two ace fighter pilots become entangled in a love triangle with beautiful Naval nurse Evelyn Johnson. But the rivalry between the friends-turned-foes is immediately put on hold when they find themselves at the center of Japan's devastating attack on Pearl Harbor on Dec. 7 1941.
111,B000GK6NFK,Roger Ulland,this is south of nowhere; dramatic funny whell acted and realiatic. Now not only do we see the world from a gay person`s eyes but we see the world from all human angles. I must edmit I was sceptical about this show. I was plessently suprised. So look if you`re into drama and you are a grown person you will truly enjoy this season. Have fun.,5,A superb angle,1,Transformers,Young teenager Sam Witwicky becomes involved in the ancient struggle between two extraterrestrial factions of transforming robots – the heroic Autobots and the evil Decepticons. Sam holds the clue to unimaginable power and the Decepticons will stop at nothing to retrieve it.
112,B000GK6NFK,Samantha,Though pricing for a very simple dvd copy of the series it's definite;y worth it to have the show and avoid all of the ridiculous &#34;the N&#34; adds constantly sliding across the bottom of the screen. There are a few song differences but nothing I would say changes the show. Quality is as good as it gets considering the show its self was a little bit low quality in the beginning anyways. The dvds are working great and I would highly suggest them!,5,"if you love SoN, get this!",1,Alexander,Alexander the King of Macedonia leads his legions against the giant Persian Empire. After defeating the Persians he leads his army across the then known world venturing farther than any westerner had ever gone all the way to India.
113,B000GK6NFK,"Sara E. Simmons ""Takira may""",I love love love this show/movie its great it shows drama and love relationships and break ups. Its about realizing who you are for the frist time in a new town.If you liked season one you will totally love seasons 2 and 3.,5,Great!!!!!,1,Harry Potter and the Order of the Phoenix,Returning for his fifth year of study at Hogwarts Harry is stunned to find that his warnings about the return of Lord Voldemort have been ignored. Left with no choice Harry takes matters into his own hands training a small group of students – dubbed 'Dumbledore's Army' – to defend themselves against the dark arts.
114,B000GK6NFK,"Seaneen Duggan ""Rassick""",a lovely show and much neededparticularly now in America.A genuinely nice product will scriptd and beautifully suggestive so keeps both the younger and slightly older viewer happy.,5,great light gay drama,1,Harry Potter and the Goblet of Fire,Harry starts his fourth year at Hogwarts competes in the treacherous Triwizard Tournament and faces the evil Lord Voldemort. Ron and Hermione help Harry manage the pressure – but Voldemort lurks awaiting his chance to destroy Harry and all that he stands for.
115,B000GK6NFK,shane mcbain,went down south very very quick boring to watch only wasted about 1 hour  ( 2 episodes )  couldnt get into this show,1,son,0,Hancock,Hancock is a down-and-out superhero who's forced to employ a PR expert to help repair his image when the public grows weary of all the damage he's inflicted during his lifesaving heroics. The agent's idea of imprisoning the antihero to make the world miss him proves successful but will Hancock stick to his new sense of purpose or slip back into old habits?
116,B000GK6NFK,sinny,As a mature adult lesbian I can't believe how lucky you kids are to have shows like this.  Coming out can be s...  and with shows like this hopefully it makes it easier. The script story line and acting is good by all.  I look forward to viewing Series 2 and 3.,4,Series 1,1,I Am Legend,Robert Neville is a scientist who was unable to stop the spread of the terrible virus that was incurable and man-made. Immune Neville is now the last human survivor in what is left of New York City and perhaps the world. For three years Neville has faithfully sent out daily radio messages desperate to find any other survivors who might be out there. But he is not alone.
117,B000GK6NFK,Steff,South of Nowhere is a great show and I know that the story line helps alot of teens going through the same things. I was so happy with my purchase. The item arrived 2 days before the estimated arrival time. Very happy,4,Good stuff,1,Charlie and the Chocolate Factory,A young boy wins a tour through the most magnificent chocolate factory in the world led by the world's most unusual candy maker.
118,B000GK6NFK,"SuperNaye ""Music geek ^_^""",So ever since I first saw this show on The N (before it was Teen Nick) I have been infatuated with this show. I love the storyline of Spencer and her family as they move to Los Angeles and find themselves. It's an amazing show full of twists and turns. I'm extremely glad with my purchase and I will be buying the other seasons soon. You should definitely check this show out. It's truly amazing.,5,South of Nowhere is still amazing,1,Ratatouille,A rat named Remy dreams of becoming a great French chef despite his family's wishes and the obvious problem of being a rat in a decidedly rodent-phobic profession. When fate places Remy in the sewers of Paris he finds himself ideally situated beneath a restaurant made famous by his culinary hero Auguste Gusteau. Despite the apparent dangers of being an unlikely - and certainly unwanted - visitor in the kitchen of a fine French restaurant Remy's passion for cooking soon sets into motion a hilarious and exciting rat race that turns the culinary world of Paris upside down.
119,B000GK6NFK,"SurfEr ""Er""",This series is absolutly amazing. if you have never watched it you will fall in love with the characters from episode 1. unfortunatly the dvd box set is MADE TO ORDER and DVDR which means they are burnt from  a computer and put together much like a burnt copy or bootleg copy. its ashame because this series is so good and it makes it seem not much worth it. Not saying why but I am sure they have there reasons for ending the series and not spending alot of time on the quality. Hopefully everyone enjoys the show and looks past the appearance of the box. I recommend buying it just its ashame the music is different and that the box is cheap.,3,"GREAT SERIES, CHEAPLY DISTRUBTED DVD",0,Batman Begins,Driven by tragedy billionaire Bruce Wayne dedicates his life to uncovering and defeating the corruption that plagues his home Gotham City.  Unable to work within the system he instead creates a new identity a symbol of fear for the criminal underworld - The Batman.
120,B000GK6NFK,Tara Tissink,It was great to see a series like this with a young girl coming out.. showing all the hardest parts.I Really liked the programme... its never been TOO gay.... if that makes sense (not that i mind too gay) its relatible and easy for anyone to watch.. not just us gay girls lol,5,I LOVE SOUTH OF NOWHERE,1,Madagascar: Escape 2 Africa,Alex Marty Melman Gloria King Julien Maurice the penguins and the chimps are back and still marooned on Madagascar. In the face of this obstacle the New Yorkers have hatched a plan so crazy it just might work. With military precision the penguins have repaired an old crashed plane... sort of.
121,B000GK6NFK,toby,I just recently started watching son and didn't catch it til after its dvd release.  Though its of a generation I don't understand (a friend of mine calls them the squeaky generation and i think the term fits that and i think its cute) the joys and obstacles are the same from  generation to generation.  South of Nowhere got its hooks in me with the first episode and was surprised to find one of the executive producers is rose troche who was responsible for a lot if not most of the gay films i have in my collection from my own generation.  I love the show and i think its an important show for anyone gay or straight. It isn't just about spencer and ashley and the prejudice and relationship struggles they face but also what its like to be a black boy from Ohio thrown into the big scary city being raised by a white family and struggling with the fact that he was given up by his biological mother.  It shows a mothers bigotry and how it affects her relationship with her daughter.  It shows a family that is religious but at the same time is far from perfect.  Its a show about family friends new beginnings and old problems. i love it,5,surprisingly brilliant,1,Night at the Museum: Battle of the Smithsonian,Hapless museum night watchman Larry Daley must help his living breathing exhibit friends out of a pickle now that they've been transferred to the archives at the Smithsonian Institution. Larry's (mis)adventures this time include close encounters with Amelia Earhart Abe Lincoln and Ivan the Terrible.
122,B000GK6NFK,trevsch,This show has a lot of power with likable characters and an interesting plot. I saw some episodes here and there and liked it so then I decided to get the first season and I'm very happy with it! Although Amazon.com manufactures it all on DVD-R everything was of great quality all the menus worked just fine high quality picture and packaging!,5,Meaningful show,1,X-Men Origins: Wolverine,After seeking to live a normal life Logan sets out to avenge the death of his girlfriend by undergoing the mutant Weapon X program and becoming Wolverine.
123,B000GK6NFK,Valerie Harris,This show was on for three years and I was heart-broken when this series was canceled. The story was a twist on the run-of-the-mill high-school-drama and featured a lesbian couple that had a lo of chemistry.,5,Twist on to Average High School Drama,1,The Matrix Revolutions,The human city of Zion defends itself against the massive invasion of the machines as Neo fights to end the war at another front while also opposing the rogue Agent Smith.
124,B000GK6NFK,V. Lambert,i have watched every season and it get better. wish they made more season then 3 but hey good shows end good and never drag on,5,great,1,Frozen,Young princess Anna of Arendelle dreams about finding true love at her sister Elsa’s coronation. Fate takes her on a dangerous journey in an attempt to end the eternal winter that has fallen over the kingdom. She's accompanied by ice delivery man Kristoff his reindeer Sven and snowman Olaf. On an adventure where she will find out what friendship courage family and true love really means.
125,B000GK7DPY,Mr. Bliss,This is an excellent documentary of Shangri-La and its elusive transcendental nature.,5,The Search For Shangri-La,1,The Matrix Reloaded,Six months after the events depicted in The Matrix Neo has proved to be a good omen for the free humans as more and more humans are being freed from the matrix and brought to Zion the one and only stronghold of the Resistance.  Neo himself has discovered his superpowers including super speed ability to see the codes of the things inside the matrix and a certain degree of pre-cognition. But a nasty piece of news hits the human resistance: 250000 machine sentinels are digging to Zion and would reach them in 72 hours. As Zion prepares for the ultimate war Neo Morpheus and Trinity are advised by the Oracle to find the Keymaker who would help them reach the Source.  Meanwhile Neo's recurrent dreams depicting Trinity's death have got him worried and as if it was not enough Agent Smith has somehow escaped deletion has become more powerful than before and has fixed Neo as his next target.
