,asin,reviewerName,reviewText,overall,summary,post_neg,original_title,overview
293,B000H0X79O,Ricardo Fitipaldi,Witty Clean and  super funny comedy that the whole family can enjoy.  I just wish that all Brian's shows were available.,5,LOL,1,Where the Wild Things Are,Max imagines running away from his mom and sailing to a far-off land where large talking beasts -- Ira Carol Douglas the Bull Judith and Alexander -- crown him as their king play rumpus build forts and discover secret hideaways.
294,B000H0X79O,richyrich,ha ah ha ahhha ahahaha haha ahah ahahaah hahahahah hahahahhaahhahaaha hahaha hahaha ahahaha hahahah hahah hahah hahah hahaha hahhahah TEE HEE,5,disease,1,Epic,A teenager finds herself transported to a deep forest setting where a battle between the forces of good and the forces of evil is taking place. She bands together with a rag-tag group characters in order to save their world -- and ours.
295,B000H0X79O,Robert E. Jackson,I love Brian Regan. He's funny because everybody can relate to what he talks about and doesn't need to resort to bad language and dirty stories to make people laugh. I have yet to find a comedian that's as good as he is.,5,real comedy,1,The Tourist,"American tourist Frank (Johnny Depp) meets mysterious British woman Elsie (Angelina Jolie) on the train to Venice. Romance seems to bud but there's more to her than meets the eye. Remake of the 2005 French film ""Anthony Zimmer"" written and directed by Jérôme Salle."
296,B000H0X79O,Russell Foszcz TTEE,I just LOVE Kathleen Madigan! Of all the comedians in the series she stands above and beyond the rest in the funny-bone department!,5,Comedy Central is the BEST!,1,End of Days,On December 28th 1999 the citizens of New York City are getting ready for the turn of the millennium. However the Devil decides to crash the party by coming to the city inhabiting a man's body and searching for his chosen bride a 20-year-old woman named Christine York. The world will end and the only hope lies within an atheist called Jericho Cane.
297,B000H0X79O,Sandra Dalton,Loved the Clinton jokes that's all I have to say don't have anything else to say say say say say,5,Politically funny,1,Blood Diamond,An ex-mercenary turned smuggler. A Mende fisherman. Amid the explosive civil war overtaking 1999 Sierra Leone these men join for two desperate missions: recovering a rare pink diamond of immense value and rescuing the fisherman's son conscripted as a child soldier into the brutal rebel forces ripping a swath of torture and bloodshed countrywide.
298,B000H0X79O,Seamus,It's good I used to watch it as a kid was good to watch again older as an adult b,5,Rating,1,The Wolf of Wall Street,A New York stockbroker refuses to cooperate in a large securities fraud case involving corruption on Wall Street corporate banking world and mob infiltration. Based on Jordan Belfort's autobiography.
299,B000H0X79O,Sherri Warden,You can't go wrong with this stand up comedian! He is a class act with a unique quality to him. One of my favorite aspects is I can have my children in the room and not worry about them overhearing anything inappropriate or vulgar. Definitely would recommend to others!,5,Jim Gaffigan,1,Batman Forever,The Dark Knight of Gotham City confronts a dastardly duo: Two-Face and the Riddler. Formerly District Attorney Harvey Dent Two-Face believes Batman caused the courtroom accident which left him disfigured on one side. And Edward Nygma computer-genius and former employee of millionaire Bruce Wayne is out to get the philanthropist; as The Riddler. Former circus acrobat Dick Grayson his family killed by Two-Face becomes Wayne's ward and Batman's new partner Robin.
300,B000H0X79O,stephanie koran,bought the single episode that was supposed to be dane cook but it's someone completely different. very unhappy.the only reason i bought it was for dane cook and the preview even showed it was him.,1,sucks,0,Starship Troopers,"Set in the future the story follows a young soldier named Johnny Rico and his exploits in the Mobile Infantry. Rico's military career progresses from recruit to non-commissioned officer and finally to officer against the backdrop of an interstellar war between mankind and an arachnoid species known as ""the Bugs""."
301,B000H0X79O,Stephie,Some of the acts are funnier than others... It's okay if you have nothing better to watch. It's okay. its free.,3,Ok,0,Cloud Atlas,A set of six nested stories spanning time between the 19th century and a distant post-apocalyptic future. Cloud Atlas explores how the actions and consequences of individual lives impact one another throughout the past the present and the future. Action mystery and romance weave through the story as one soul is shaped from a killer into a hero and a single act of kindness ripples across centuries to inspire a revolution in the distant future.  Based on the award winning novel by David Mitchell. Directed by Tom Tykwer and the Wachowskis.
302,B000H0X79O,Suzanne Casey,I recommend Comedy Central Stand Up because the selected comedians were really funny - found myself laughing out loud even with my headset on !,5,Funniest stuff,1,Legend of the Guardians: The Owls of Ga'Hoole,Soren a young barn owl is kidnapped by owls of St. Aggie's ostensibly an orphanage where owlets are brainwashed into becoming soldiers. He and his new friends escape to the island of Ga'Hoole to assist its noble wise owls who fight the army being created by the wicked rulers of St. Aggie's. The film is based on the first three books in the series.
303,B000H0X79O,Techvisitor Computer Repair,Was not funny to my taste. Stopped watching after 5 minutes. Was mostly acoustic singing with some dry humor. Bland.,1,boring. slightly funny,0,Catwoman,"Liquidated after discovering a corporate conspiracy mild-mannered graphic artist Patience Phillips washes up on an island where she's resurrected and endowed with the prowess of a cat -- and she's eager to use her new skills ... as a vigilante. Before you can say ""cat and mouse"" handsome gumshoe Tom Lone is on her tail."
304,B000H0X79O,Testlight,Jim Gaffigan never fails to entertain. One of the funniest comedians of this generation. Highly recommended. Guaranteed to make your day.,5,Fun for the whole Family!,1,Hercules,Fourteen hundred years ago a tormented soul walked the earth that was neither man nor god. Hercules was the powerful son of the god king Zeus for this he received nothing but suffering his entire life. After twelve arduous labors and the loss of his family this dark world-weary soul turned his back on the gods finding his only solace in bloody battle. Over the years he warmed to the company of six similar souls their only bond being their love of fighting and presence of death. These men and woman never question where they go to fight or why or whom just how much they will be paid. Now the King of Thrace has hired these mercenaries to train his men to become the greatest army of all time. It is time for this bunch of lost souls to finally have their eyes opened to how far they have fallen when they must train an army to become as ruthless and blood thirsty as their reputation has become.
305,B000H0X79O,"The Brookster ""super mom""",To be honest with you I am not familiar with most of these comedians however that did not matter at all. I multi- tasked.  Cooking and laughing at the same time.  I wonder how many calories I burned?  Seriously if you want to laugh non-stop by all means watch Comedy Central.  You won't regret it.,5,FUNNY WITH A CAPITAL F,1,Treasure Planet,"When space galleon cabin boy Jim Hawkins discovers a map to an intergalactic ""loot of a thousand worlds"" a cyborg cook named John Silver teaches him to battle supernovas and space storms. But soon Jim realizes Silver is a pirate intent on mutiny!"
306,B000H0X79O,Tiger,Each comedian has their own style but most all seasons had one or two who had me laughing to tears. I highly recommend the whole series.,5,Funny,1,Land of the Lost,On his latest expedition Dr. Rick Marshall is sucked into a space-time vortex alongside his research assistant and a redneck survivalist. In this alternate universe the trio make friends with a primate named Chaka their only ally in a world full of dinosaurs and other fantastic creatures.
307,B000H0X79O,timothy keough,it was very very very funny i laughed and laughed until i stopped laughing brian regan is a hilarious dude,5,Brian Regan rocks,1,The Expendables 3,Barney Christmas and the rest of the team comes face-to-face with Conrad Stonebanks who years ago co-founded The Expendables with Barney. Stonebanks subsequently became a ruthless arms trader and someone who Barney was forced to kill… or so he thought. Stonebanks who eluded death once before now is making it his mission to end The Expendables -- but Barney has other plans. Barney decides that he has to fight old blood with new blood and brings in a new era of Expendables team members recruiting individuals who are younger faster and more tech-savvy. The latest mission becomes a clash of classic old-school style versus high-tech expertise in the Expendables’ most personal battle yet.
308,B000H0X79O,"T. Marie Neville ""SeriouslyFolks""",Each and every video for every season of Comedy Central drags and hangs up. The video stops while audio hums right along. Really really annoying. No other movies or tv shows play this way. I am playing these videos on TV through my Wii system. One video stops altogether and was hung up till the next day. I had to unplug the Wii to  unsung the video but every comedy central still hangs up. Fix this Amazon.,2,Poor quality play,0,Point Break,"A young undercover FBI agent infiltrates a gang of thieves who share a common interest in extreme sports. A remake of the 1991 film ""Point Break""."
309,B000H0X79O,T. McLaughlin,Greg Giraldo is one of the great comedians its nice to see some of his older pre-roast stuff he will be missed,5,Laughing out loud,1,Son of the Mask,"Tim Avery an aspiring cartoonist finds himself in a predicament when his dog stumbles upon the mask of Loki. Then after conceiving an infant son ""born of the mask"" he discovers just how looney child raising can be."
310,B000H0X79O,Todd A. Brownlie,First heard his stand-up on CD when I worked at Borders a few years back.  Sometimes he gets a bit carried away (a lotta comics tend to though) and his comedy comes across dopey yet easy to relate to.  Clean (no naughty words or uncouth situations here!) family-fun comedy (dirty or clean as long as a comedian can deliver to the audience well then he/she is funny in my eyes).,4,Brian Regan,1,In the Heart of the Sea,In the winter of 1820 the New England whaling ship Essex was assaulted by something no one could believe: a whale of mammoth size and will and an almost human sense of vengeance.  The real-life maritime disaster would inspire Herman Melville’s Moby Dick.  But that told only half the story.  “Heart of the Sea” reveals the encounter’s harrowing aftermath as the ship’s surviving crew is pushed to their limits and forced to do the unthinkable to stay alive.  Braving storms starvation panic and despair the men will call into question their deepest beliefs from the value of their lives to the morality of their trade as their captain searches for direction on the open sea and his first mate still seeks to bring the great whale down.
311,B000H0X79O,Tom Morrow,I guess he got funny later in his career.  After 5 min I turned it off.  He spent a lot of time crawling on the ground.,2,Not what I expected from him,0,The Adventures of Pluto Nash,The year is 2087 the setting is the moon. Pluto Nash the high-flying successful owner of the hottest nightclub in the universe finds himself in trouble when he refuses to sell his club to lunar gangster Mogan who just happens to be helping the mysterious Rex Crater mastermind a plan to take over the entire moon.
312,B000H0X79O,tx,it was funny why do I have to put so many words on here for this I mean come on,3,It was funny,0,Green Zone,During the U.S.-led occupation of Baghdad in 2003 Chief Warrant Officer Roy Miller and his team of Army inspectors were dispatched to find weapons of mass destruction believed to be stockpiled in the Iraqi desert. Rocketing from one booby-trapped and treacherous site to the next the men search for deadly chemical agents but stumble instead upon an elaborate cover-up that threatens to invert the purpose of their mission.
313,B000H0X79O,Uncle Dave,I idi not think that it was funny may be it is aimed at a youger audiance I doubt it,2,skip it,0,The Peanuts Movie,Snoopy embarks upon his greatest mission as he and his team take to the skies to pursue their arch-nemesis while his best pal Charlie Brown begins his own epic quest back home.
314,B000H0X79O,Vincent Socci,Comedy Central always does a great job with their stand up comedians.  Sure there will be some comedians that you like more or less than others but all of them will bring a smile to your face.I appreciate that Comedy Central does keep the language controlled especially since so many comedians seem to drop those bombs so frequently. The &#34;bleeps&#34; are annoying but I would rather hear them than the swearing.  I do wish they would keep out some of the indecent topics and references.  I am not expecting wholesome child-friendly comedy but I think we should be able to expect to not be uncomfortable hearing it with friends in the room.Overall I find these quick little stand up sessions to be great entertainment while hanging out with friends or even waiting at the airport.  Thanks Amazon for having these available.,4,Always a great pick me up,1,The Spanish Prisoner,An employee of a corporation with a lucrative secret process is tempted to betray it. But there's more to it than that.
315,B000H0X79O,"West Side Wonder ""Matt""",Brian Regan is a smart comedian who knows you don't have to be dirty to be funny!  Love all of his stuff & have watched it & re-watched it.  He brings sarcastic humor to everyday stuff and his faces and gestures enhance the routine.  All around class act!,5,"Brian Regan - clean, class act!",1,The Mummy Returns,Rick and Evelyn O'Connell along with their 8 year old son Alex discover the key to the legendary Scorpion King's might the fabled Bracelet of Anubis. Unfortunately a newly resurrected Imhotep has designs on the bracelet as well and isn't above kidnapping its new bearer Alex to gain control of Anubis' otherworldly army.
316,B000H0X79O,William Harrell,some of the endings to his songs where not there. but great quality and streamed at a good speed. all an all okl,3,I feel they cut it short,0,Gangs of New York,It's 1863. America was born in the streets. Amsterdam Vallon returns to the Five Points of America to seek vengeance against the psychotic gangland kingpin Bill the Butcher who murdered his father years earlier. With an eager pickpocket by his side and a whole new army Vallon fights his way to seek vengeance on the Butcher and restore peace in the area.
317,B000H0X79O,Woody Muire,Some of the jokes are dated but these are mostly still funny routines.  If you want to laugh for 20 minutes check them out.,4,Comedy blast from the past.,1,The last samurai,A Westerner finds refuge with a group of women in a church during Japan's rape of Nanking in 1937. Posing as a priest he attempts to lead the women to safety.
318,B000H0YRNY,65DGW65,Hate this.  Did not intend to buy it.  Could not return it after the transaction.  One click is great but it's issue is if your connection stalls you may inadvertently buy things you did not intend to buy.  If I could give this negative stars I would.,1,One click is the root of all evil,0,Surf's Up,Cody is a surfing penguin from Shiverpool who dreams of making it big and being like his idol Big Z. On his journey he discovers his talents are not all he thinks they are and he must learn to accept that their is more to surfing than fame and fortune.  Surf's Up is a 2007 American computer-animated mockumentary film produced by Sony Pictures Animation and distributed by Columbia Pictures and ImageWorks Studios. It stars the voices of Shia LaBeouf Jeff Bridges Zooey Deschanel Jon Heder among others.
319,B000H0YRNY,Adina Everett,When I found out his was on Prime I flipped. Danny Phantom was my childhood and still one of my favorite shows. I hadn't seen it in well over 5 years. This seriously made my day and I would recommend Seasons 2 and 3 as well.,5,YES.,1,The Stepford Wives,What does it take to become a Stepford wife a woman perfect beyond belief? Ask the Stepford husbands who've created this high-tech terrifying little town.
320,B000H0YRNY,Al,The kids love this show.,5,Fun show for the kids,1,Black Hawk Down,When U.S. Rangers and an elite Delta Force team attempt to kidnap two underlings of a Somali warlord their Black Hawk helicopters are shot down and the Americans suffer heavy casualties facing intense fighting from the militia on the ground.
321,B000H0YRNY,Allie,I'm sorry but i loved this show when it was on and it's still one of my favorites. xD Yay Danny Phantom!,5,Seriously my favorite xD,1,The Campaign,Two rival politicians compete to win an election to represent their small North Carolina congressional district in the United States House of Representatives.
322,B000H0YRNY,amacoop,My teenage daughter used to watch this show now she is sharing it with her younger brother and sister to occupy themselves during our many snow days home from school!  They get a thrill from spending time with big sis watching a fun show!,4,Kids love it,1,The Fifth Element,In 2257 a taxi driver is unintentionally given the task of saving a young girl who is part of the key that will ensure the survival of humanity.
323,B000H0YRNY,"Amanda ""AnimeGirl""","Unlike the previous manufactured on demand (MOD) using DVD-Rs releases that had been available on Amazon this is an official release by Shout! Factory. The picture and sound on this 4 disc release is great and each disc has 5 episodes on it. Also unlike the MOD release this release has nicer main menus on the discs (the theme song plays while it loops through character images) and each episode has chapters (meaning when you click the next button it doesn't skip the entire episode). Like the MOD release this release has no extras but that won't stop me from buying the seasons 2 and 3 releases though (I love this show and I personally don't care that much if it has no extras/bonus features - extras/bonus features are just that to me an extra/a bonus especially when its only $20 -  but again that's me I know others look at extras/bonus features when making a decision to buy a DVD). The only ""flaws"" I found with this release is that on the inside of the case it lists what episodes are on each disc but it does not list them in the order they actually play on each disc (except disc 2 that one is listed in the same order it actually plays on the disc) and the cover image is from season 2 not 1. Neither of these ""flaws"" affect the great quality of the show or the DVDs of course I just wanted to mention them for those who may care and to give a detailed product review. This set does contain and play all 20 episodes of the first season in the correct order (except #2 and #3 are swapped but it doesn't affect the story or anything). Below is the order the episodes play:1.  Mystery Meat2.  One of a Kind (supposed to be episode 3)3.  Parental Bonding (supposed to be episode 2)4.  Attack of the Killer Garage Sale5.  Splitting Images6.  What You Want7.  Bitter Reunions8.  Prisoners of Love9.  My Brother's Keeper10.  Shades of Gray11.  Fanning the Flames12.  Teacher of the Year13.  ""13""14.  Public Enemies15.  Fright Night16.  Maternal Instinct17.  Lucky in Love18.  Life Lessons19.  The Million Dollar Ghost20.  Control FreaksI hope that helps anyone thinking of buying this great DVD release of this wonderful show!!!",5,Great Show And Great DVD Release!,1,Sex and the City 2,Carrie Charlotte and Miranda are all married now but they're still up for a little fun in the sun. When Samantha gets the chance to visit one of the most extravagant vacation destinations on the planet and offers to bring them all along they surmise that a women-only retreat may be the perfect excuse to eschew their responsibilities and remember what life was like before they decided to settle down.
324,B000H0YRNY,Amazon Customer,great puns and so many blatant clues. it's still hilarious as an adult. always looked for it on Netflix so glad it's on Amazon now.,5,"""Feast on my VENGEANCE!""",1,The Road to El Dorado,"After a failed swindle two con-men end up with a map to El Dorado the fabled ""city of gold"" and an unintended trip to the New World.  Much to their surprise the map does lead the pair to the mythical city where the startled inhabitants promptly begin to worship them as gods.  The only question is do they take the worshipful natives for all they're worth or is there a bit more to El Dorado than riches?"
325,B000H0YRNY,Amazon Customer,My 9 year-old son liked it and I thought it was pretty good also.  Therefore I would recommend it to adults and children.,4,My 9 year-old son liked it.,1,Ice Age: Continental Drift,Manny Diego and Sid embark upon another adventure after their continent is set adrift. Using an iceberg as a ship they encounter sea creatures and battle pirates as they explore a new world.
326,B000H0YRNY,Amazon Customer,My kids and I love this show.Please amazon don't remove this show it is very funny and entertaining can't stop watching it.,5,GREAT SHOW,1,Cinderella,When her father unexpectedly passes away young Ella finds herself at the mercy of her cruel stepmother and her daughters. Never one to give up hope Ella's fortunes begin to change after meeting a dashing stranger in the woods.
327,B000H0YRNY,Amazon Customer,The quality was great and i would watch it over and over.  I recommend this for anyone who loved the show or looking for something new to watch,5,Danny Phantom is awsome,1,The Lovely Bones,After being brutally murdered 14-year-old Susie Salmon watches from heaven over her grief-stricken family -- and her killer. As she observes their daily lives she must balance her thirst for revenge with her desire for her family to heal.
